<?xml version="1.0" encoding="UTF-8"?>
<!-- Plantilla para implementar claves -->
<xs:schema xmlns:xs="http://www.w3.org/2001/XMLSchema">
  <xs:element name="plantillaClave">
    <xs:complexType>
      <xs:choice maxOccurs="unbounded">
        <xs:element ref="elementoDependiente"/>
        <xs:element ref="elementoIndependiente"/>
      </xs:choice>
    </xs:complexType>
    <xs:key name="relacion">
      <xs:selector xpath="elementoIndependiente"/>
      <xs:field xpath="@atributoIndependiente"/>
    </xs:key>
    <xs:keyref name="referenciaClave" refer="relacion">
      <xs:selector xpath="elementoDependiente"/>
      <xs:field xpath="@atributoDependiente"/>
    </xs:keyref>
  </xs:element>
  
  <xs:element name="elementoDependiente">
    <xs:complexType>
      <xs:attribute name="nombreDependiente" type="xs:string" use="required"/>
      <xs:attribute name="atributoDependiente" type="xs:string" use="required"/>
    </xs:complexType>
  </xs:element>
  
  <xs:element name="elementoIndependiente">
    <xs:complexType>
      <xs:sequence>
        <xs:element name="nombreIndependiente" type="xs:string"/>
      </xs:sequence>
      <xs:attribute name="atributoIndependiente" type="xs:string" use="required"/>
    </xs:complexType>
  </xs:element>

</xs:schema>
